{
  "type": "vocabulary",
  "epochs": [
    "epoch_post_cataclysm"
  ],
  "canon": "primary",
  "sources": [
    "Varuna's Field Diary design",
    "AI_CONTEXT.md"
  ],
  "id": "word_kia_uvai",
  "word": "uvai",
  "language": "kia",
  "gloss": "memory, or a thing remembered",
  "learned_from": [
    "npc_thrali",
    "npc_ushi"
  ],
  "notes": "Completes thal-uvai. Compresses an entire trophic chain into a phrase that sounds like superstition."
}
